Sheet: Лист 1
A1: Отчет по товарам с 01.01.1997 по 31.01.1997
A2: Номер заказа | B2: Дата заказа | C2: Артикул товара | D2: Наименование товара | E2: Количество | F2: Цена | G2: Сумма
A3: 10400 | B3: 01.01.1997 0:00:00 | C3: 29 | D3: Thüringer Rostbratwurst | E3: 21 | F3: 99 | G3: =RC[-2]*RC[-1] -> 2079
A4: 10400 | B4: 01.01.1997 0:00:00 | C4: 35 | D4: Steeleye Stout | E4: 35 | F4: 14.4 | G4: =RC[-2]*RC[-1] -> 504
A5: 10400 | B5: 01.01.1997 0:00:00 | C5: 49 | D5: Maxilaku | E5: 30 | F5: 16 | G5: =RC[-2]*RC[-1] -> 480
A6: 10401 | B6: 01.01.1997 0:00:00 | C6: 30 | D6: Nord-Ost Matjeshering | E6: 18 | F6: 20.7 | G6: =RC[-2]*RC[-1] -> 372.59999999999997
A7: 10401 | B7: 01.01.1997 0:00:00 | C7: 56 | D7: Gnocchi di nonna Alice | E7: 70 | F7: 30.4 | G7: =RC[-2]*RC[-1] -> 2128
A8: 10401 | B8: 01.01.1997 0:00:00 | C8: 65 | D8: Louisiana Fiery Hot Pepper Sauce | E8: 20 | F8: 16.8 | G8: =RC[-2]*RC[-1] -> 336
A9: 10401 | B9: 01.01.1997 0:00:00 | C9: 71 | D9: Fløtemysost | E9: 60 | F9: 17.2 | G9: =RC[-2]*RC[-1] -> 1032
A10: 10402 | B10: 02.01.1997 0:00:00 | C10: 23 | D10: Tunnbröd | E10: 60 | F10: 7.2 | G10: =RC[-2]*RC[-1] -> 432
A11: 10402 | B11: 02.01.1997 0:00:00 | C11: 63 | D11: Vegie-spread | E11: 65 | F11: 35.1 | G11: =RC[-2]*RC[-1] -> 2281.5
A12: 10403 | B12: 03.01.1997 0:00:00 | C12: 16 | D12: Pavlova | E12: 21 | F12: 13.9 | G12: =RC[-2]*RC[-1] -> 291.90000000000003
A13: 10403 | B13: 03.01.1997 0:00:00 | C13: 48 | D13: Chocolade | E13: 70 | F13: 10.199999999999999 | G13: =RC[-2]*RC[-1] -> 714
A14: 10404 | B14: 03.01.1997 0:00:00 | C14: 26 | D14: Gumbär Gummibärchen | E14: 30 | F14: 24.9 | G14: =RC[-2]*RC[-1] -> 747
A15: 10404 | B15: 03.01.1997 0:00:00 | C15: 42 | D15: Singaporean Hokkien Fried Mee | E15: 40 | F15: 11.2 | G15: =RC[-2]*RC[-1] -> 448
A16: 10404 | B16: 03.01.1997 0:00:00 | C16: 49 | D16: Maxilaku | E16: 30 | F16: 16 | G16: =RC[-2]*RC[-1] -> 480
A17: 10405 | B17: 06.01.1997 0:00:00 | C17: 3 | D17: Aniseed Syrup | E17: 50 | F17: 8 | G17: =RC[-2]*RC[-1] -> 400
A18: 10406 | B18: 07.01.1997 0:00:00 | C18: 1 | D18: Chai | E18: 10 | F18: 14.4 | G18: =RC[-2]*RC[-1] -> 144
A19: 10406 | B19: 07.01.1997 0:00:00 | C19: 21 | D19: Sir Rodney's Scones | E19: 30 | F19: 8 | G19: =RC[-2]*RC[-1] -> 240
A20: 10406 | B20: 07.01.1997 0:00:00 | C20: 28 | D20: Rössle Sauerkraut | E20: 42 | F20: 36.4 | G20: =RC[-2]*RC[-1] -> 1528.8
A21: 10406 | B21: 07.01.1997 0:00:00 | C21: 36 | D21: Inlagd Sill | E21: 5 | F21: 15.2 | G21: =RC[-2]*RC[-1] -> 76
A22: 10406 | B22: 07.01.1997 0:00:00 | C22: 40 | D22: Boston Crab Meat | E22: 2 | F22: 14.7 | G22: =RC[-2]*RC[-1] -> 29.4
A23: 10407 | B23: 07.01.1997 0:00:00 | C23: 11 | D23: Queso Cabrales | E23: 30 | F23: 16.8 | G23: =RC[-2]*RC[-1] -> 504
A24: 10407 | B24: 07.01.1997 0:00:00 | C24: 69 | D24: Gudbrandsdalsost | E24: 15 | F24: 28.8 | G24: =RC[-2]*RC[-1] -> 432
A25: 10407 | B25: 07.01.1997 0:00:00 | C25: 71 | D25: Fløtemysost | E25: 15 | F25: 17.2 | G25: =RC[-2]*RC[-1] -> 258
A26: 10408 | B26: 08.01.1997 0:00:00 | C26: 37 | D26: Gravad lax | E26: 10 | F26: 20.8 | G26: =RC[-2]*RC[-1] -> 208
A27: 10408 | B27: 08.01.1997 0:00:00 | C27: 54 | D27: Tourtière | E27: 6 | F27: 5.9 | G27: =RC[-2]*RC[-1] -> 35.400000000000006
A28: 10408 | B28: 08.01.1997 0:00:00 | C28: 62 | D28: Tarte au sucre | E28: 35 | F28: 39.4 | G28: =RC[-2]*RC[-1] -> 1379
A29: 10409 | B29: 09.01.1997 0:00:00 | C29: 14 | D29: Tofu | E29: 12 | F29: 18.600000000000001 | G29: =RC[-2]*RC[-1] -> 223.20000000000002
A30: 10409 | B30: 09.01.1997 0:00:00 | C30: 21 | D30: Sir Rodney's Scones | E30: 12 | F30: 8 | G30: =RC[-2]*RC[-1] -> 96
A31: 10410 | B31: 10.01.1997 0:00:00 | C31: 33 | D31: Geitost | E31: 49 | F31: 2 | G31: =RC[-2]*RC[-1] -> 98
A32: 10410 | B32: 10.01.1997 0:00:00 | C32: 59 | D32: Raclette Courdavault | E32: 16 | F32: 44 | G32: =RC[-2]*RC[-1] -> 704
A33: 10411 | B33: 10.01.1997 0:00:00 | C33: 41 | D33: Jack's New England Clam Chowder | E33: 25 | F33: 7.7 | G33: =RC[-2]*RC[-1] -> 192.5
A34: 10411 | B34: 10.01.1997 0:00:00 | C34: 44 | D34: Gula Malacca | E34: 40 | F34: 15.5 | G34: =RC[-2]*RC[-1] -> 620
A35: 10411 | B35: 10.01.1997 0:00:00 | C35: 59 | D35: Raclette Courdavault | E35: 9 | F35: 44 | G35: =RC[-2]*RC[-1] -> 396
A36: 10412 | B36: 13.01.1997 0:00:00 | C36: 14 | D36: Tofu | E36: 20 | F36: 18.600000000000001 | G36: =RC[-2]*RC[-1] -> 372
A37: 10413 | B37: 14.01.1997 0:00:00 | C37: 1 | D37: Chai | E37: 24 | F37: 14.4 | G37: =RC[-2]*RC[-1] -> 345.6
A38: 10413 | B38: 14.01.1997 0:00:00 | C38: 62 | D38: Tarte au sucre | E38: 40 | F38: 39.4 | G38: =RC[-2]*RC[-1] -> 1576
A39: 10413 | B39: 14.01.1997 0:00:00 | C39: 76 | D39: Lakkalikööri | E39: 14 | F39: 14.4 | G39: =RC[-2]*RC[-1] -> 201.6
A40: 10414 | B40: 14.01.1997 0:00:00 | C40: 19 | D40: Teatime Chocolate Biscuits | E40: 18 | F40: 7.3 | G40: =RC[-2]*RC[-1] -> 131.4
A41: 10414 | B41: 14.01.1997 0:00:00 | C41: 33 | D41: Geitost | E41: 50 | F41: 2 | G41: =RC[-2]*RC[-1] -> 100
A42: 10415 | B42: 15.01.1997 0:00:00 | C42: 17 | D42: Alice Mutton | E42: 2 | F42: 31.2 | G42: =RC[-2]*RC[-1] -> 62.4
A43: 10415 | B43: 15.01.1997 0:00:00 | C43: 33 | D43: Geitost | E43: 20 | F43: 2 | G43: =RC[-2]*RC[-1] -> 40
A44: 10416 | B44: 16.01.1997 0:00:00 | C44: 19 | D44: Teatime Chocolate Biscuits | E44: 20 | F44: 7.3 | G44: =RC[-2]*RC[-1] -> 146
A45: 10416 | B45: 16.01.1997 0:00:00 | C45: 53 | D45: Perth Pasties | E45: 10 | F45: 26.2 | G45: =RC[-2]*RC[-1] -> 262
A46: 10416 | B46: 16.01.1997 0:00:00 | C46: 57 | D46: Ravioli Angelo | E46: 20 | F46: 15.6 | G46: =RC[-2]*RC[-1] -> 312
A47: 10417 | B47: 16.01.1997 0:00:00 | C47: 38 | D47: Côte de Blaye | E47: 50 | F47: 210.8 | G47: =RC[-2]*RC[-1] -> 10540
A48: 10417 | B48: 16.01.1997 0:00:00 | C48: 46 | D48: Spegesild | E48: 2 | F48: 9.6 | G48: =RC[-2]*RC[-1] -> 19.2
A49: 10417 | B49: 16.01.1997 0:00:00 | C49: 68 | D49: Scottish Longbreads | E49: 36 | F49: 10 | G49: =RC[-2]*RC[-1] -> 360
A50: 10417 | B50: 16.01.1997 0:00:00 | C50: 77 | D50: Original Frankfurter grüne Soße | E50: 35 | F50: 10.4 | G50: =RC[-2]*RC[-1] -> 364
A51: 10418 | B51: 17.01.1997 0:00:00 | C51: 2 | D51: Chang | E51: 60 | F51: 15.2 | G51: =RC[-2]*RC[-1] -> 912
A52: 10418 | B52: 17.01.1997 0:00:00 | C52: 47 | D52: Zaanse koeken | E52: 55 | F52: 7.6 | G52: =RC[-2]*RC[-1] -> 418
A53: 10418 | B53: 17.01.1997 0:00:00 | C53: 61 | D53: Sirop d'érable | E53: 16 | F53: 22.8 | G53: =RC[-2]*RC[-1] -> 364.8
A54: 10418 | B54: 17.01.1997 0:00:00 | C54: 74 | D54: Longlife Tofu | E54: 15 | F54: 8 | G54: =RC[-2]*RC[-1] -> 120
A55: 10419 | B55: 20.01.1997 0:00:00 | C55: 60 | D55: Camembert Pierrot | E55: 60 | F55: 27.2 | G55: =RC[-2]*RC[-1] -> 1632
A56: 10419 | B56: 20.01.1997 0:00:00 | C56: 69 | D56: Gudbrandsdalsost | E56: 20 | F56: 28.8 | G56: =RC[-2]*RC[-1] -> 576
A57: 10420 | B57: 21.01.1997 0:00:00 | C57: 9 | D57: Mishi Kobe Niku | E57: 20 | F57: 77.599999999999994 | G57: =RC[-2]*RC[-1] -> 1552
A58: 10420 | B58: 21.01.1997 0:00:00 | C58: 13 | D58: Konbu | E58: 2 | F58: 4.8 | G58: =RC[-2]*RC[-1] -> 9.6
A59: 10420 | B59: 21.01.1997 0:00:00 | C59: 70 | D59: Outback Lager | E59: 8 | F59: 12 | G59: =RC[-2]*RC[-1] -> 96
A60: 10420 | B60: 21.01.1997 0:00:00 | C60: 73 | D60: Röd Kaviar | E60: 20 | F60: 12 | G60: =RC[-2]*RC[-1] -> 240
A61: 10421 | B61: 21.01.1997 0:00:00 | C61: 19 | D61: Teatime Chocolate Biscuits | E61: 4 | F61: 7.3 | G61: =RC[-2]*RC[-1] -> 29.2
A62: 10421 | B62: 21.01.1997 0:00:00 | C62: 26 | D62: Gumbär Gummibärchen | E62: 30 | F62: 24.9 | G62: =RC[-2]*RC[-1] -> 747
A63: 10421 | B63: 21.01.1997 0:00:00 | C63: 53 | D63: Perth Pasties | E63: 15 | F63: 26.2 | G63: =RC[-2]*RC[-1] -> 393
A64: 10421 | B64: 21.01.1997 0:00:00 | C64: 77 | D64: Original Frankfurter grüne Soße | E64: 10 | F64: 10.4 | G64: =RC[-2]*RC[-1] -> 104
A65: 10422 | B65: 22.01.1997 0:00:00 | C65: 26 | D65: Gumbär Gummibärchen | E65: 2 | F65: 24.9 | G65: =RC[-2]*RC[-1] -> 49.8
A66: 10423 | B66: 23.01.1997 0:00:00 | C66: 31 | D66: Gorgonzola Telino | E66: 14 | F66: 10 | G66: =RC[-2]*RC[-1] -> 140
A67: 10423 | B67: 23.01.1997 0:00:00 | C67: 59 | D67: Raclette Courdavault | E67: 20 | F67: 44 | G67: =RC[-2]*RC[-1] -> 880
A68: 10424 | B68: 23.01.1997 0:00:00 | C68: 35 | D68: Steeleye Stout | E68: 60 | F68: 14.4 | G68: =RC[-2]*RC[-1] -> 864
A69: 10424 | B69: 23.01.1997 0:00:00 | C69: 38 | D69: Côte de Blaye | E69: 49 | F69: 210.8 | G69: =RC[-2]*RC[-1] -> 10329.200000000001
A70: 10424 | B70: 23.01.1997 0:00:00 | C70: 68 | D70: Scottish Longbreads | E70: 30 | F70: 10 | G70: =RC[-2]*RC[-1] -> 300
A71: 10425 | B71: 24.01.1997 0:00:00 | C71: 55 | D71: Pâté chinois | E71: 10 | F71: 19.2 | G71: =RC[-2]*RC[-1] -> 192
A72: 10425 | B72: 24.01.1997 0:00:00 | C72: 76 | D72: Lakkalikööri | E72: 20 | F72: 14.4 | G72: =RC[-2]*RC[-1] -> 288
A73: 10426 | B73: 27.01.1997 0:00:00 | C73: 56 | D73: Gnocchi di nonna Alice | E73: 5 | F73: 30.4 | G73: =RC[-2]*RC[-1] -> 152
A74: 10426 | B74: 27.01.1997 0:00:00 | C74: 64 | D74: Wimmers gute Semmelknödel | E74: 7 | F74: 26.6 | G74: =RC[-2]*RC[-1] -> 186.20000000000002
A75: 10427 | B75: 27.01.1997 0:00:00 | C75: 14 | D75: Tofu | E75: 35 | F75: 18.600000000000001 | G75: =RC[-2]*RC[-1] -> 651
A76: 10428 | B76: 28.01.1997 0:00:00 | C76: 46 | D76: Spegesild | E76: 20 | F76: 9.6 | G76: =RC[-2]*RC[-1] -> 192
A77: 10429 | B77: 29.01.1997 0:00:00 | C77: 50 | D77: Valkoinen suklaa | E77: 40 | F77: 13 | G77: =RC[-2]*RC[-1] -> 520
A78: 10429 | B78: 29.01.1997 0:00:00 | C78: 63 | D78: Vegie-spread | E78: 35 | F78: 35.1 | G78: =RC[-2]*RC[-1] -> 1228.5
A79: 10430 | B79: 30.01.1997 0:00:00 | C79: 17 | D79: Alice Mutton | E79: 45 | F79: 31.2 | G79: =RC[-2]*RC[-1] -> 1404
A80: 10430 | B80: 30.01.1997 0:00:00 | C80: 21 | D80: Sir Rodney's Scones | E80: 50 | F80: 8 | G80: =RC[-2]*RC[-1] -> 400
A81: 10430 | B81: 30.01.1997 0:00:00 | C81: 56 | D81: Gnocchi di nonna Alice | E81: 30 | F81: 30.4 | G81: =RC[-2]*RC[-1] -> 912
A82: 10430 | B82: 30.01.1997 0:00:00 | C82: 59 | D82: Raclette Courdavault | E82: 70 | F82: 44 | G82: =RC[-2]*RC[-1] -> 3080
A83: 10431 | B83: 30.01.1997 0:00:00 | C83: 17 | D83: Alice Mutton | E83: 50 | F83: 31.2 | G83: =RC[-2]*RC[-1] -> 1560
A84: 10431 | B84: 30.01.1997 0:00:00 | C84: 40 | D84: Boston Crab Meat | E84: 50 | F84: 14.7 | G84: =RC[-2]*RC[-1] -> 735
A85: 10431 | B85: 30.01.1997 0:00:00 | C85: 47 | D85: Zaanse koeken | E85: 30 | F85: 7.6 | G85: =RC[-2]*RC[-1] -> 228
A86: 10432 | B86: 31.01.1997 0:00:00 | C86: 26 | D86: Gumbär Gummibärchen | E86: 10 | F86: 24.9 | G86: =RC[-2]*RC[-1] -> 249
A87: 10432 | B87: 31.01.1997 0:00:00 | C87: 54 | D87: Tourtière | E87: 40 | F87: 5.9 | G87: =RC[-2]*RC[-1] -> 236
F88: =AVERAGE(R[-86]C:R[-1]C) -> 24.485882352941179 | G88: =SUM(R[-86]C:R[-1]C) -> 66692.800000000003